<?xml version="1.0" encoding="UTF-8"?>
<xs:schema xmlns:xs="http://www.w3.org/2001/XMLSchema" elementFormDefault="qualified">
	
	<xs:element name="userDatabase">
		<xs:complexType>
			<xs:sequence>
				<xs:element name="eintrag" minOccurs="0" maxOccurs="unbounded">
					<xs:complexType>
						<xs:sequence>
							<xs:element name="nachname" type="xs:string" />
							<xs:element name="vorname" type="xs:string" />
							<xs:element name="status" type="xs:string" />
						</xs:sequence>
						<xs:attribute name="id" type="xs:integer" />	
					</xs:complexType>
				</xs:element>
			</xs:sequence>
		</xs:complexType>
	</xs:element>

</xs:schema>